"estabelecimento","total gasto"
"CIA. INDUSTRIAL DE GRANDES HOTÉIS - HOTEL GLÓRIA","883145,39"
"BOURBON IBIRAPUERA HOTEL & CONVENTION","752470,789999986"
"ABACO SCP SAINT MORITZ","733058,020000009"
"SAUIPE S.A - SAUIPE PARK",569531
"NOVA RIOTEL EMPREENDIMENTOS HOTELEIROS LTDA","423786,030000001"
"SAINT MORITZ HOT. ACCOR BRASIL S.A.","400635,77"
"PREDIAL E ADMINISTRADORA  HOTEIS PLAZA S/A-SAN RAFAEL","360715,31"
"CIA TROPICAL DE HOTEIS AMAZONIA","344015,469999999"
"PAULISTA PRAIA HOTEL S/A","328751,15"
"TIMES SQUARE HOT. ACCOR BRASIL S.A","325964,419999999"
"COMPANHIA HOTÉIS PALACE","280886,88"
"BRASILTON BELÉM HOTÉIS E TURISMO S.A.","255921,85"
"HOTÉIS OTHON S/A","244788,31"
"ROYALTY BARRA HOTEL","189278,9"
"PESTANA RIO ATLANTICA HOTEL","180494,02"
"LA HOTELS EMPREENDIMENTOS 2 LTDA-GOLDEN TULIP REGENTE","174637,13"
"MAQUINÉ EMPREENDIMENTOS S/A","168743,46"
"HOTEL DELLA VOLPE LTDA - GOLDEN TULIP REGENTE","149572,1"
"ESTANPLAZA ADMINISTRADORA HOTELARIA E COMERCIAL LT","145963,86"
"NOVOTEL JARAGUA SÃO PAULO CONVENTIONS","134521,01"
"HOTELARIA ACCOR BRASIL S/A","133513,92"
"HOTEL NOVO MUNDOLTDA","128991,27"
"HOTEL ILHA DE SANTO AMARO LTDA - STRAND","128222,68"
"HOTEL BOURBON DE CURITIBA LTDA","123223,88"
"DIVISO EMPREENDIMENTOS HOTELEIROS S/A","121792,26"
"LUCSIM HOTÉIS LTDA","119668,96"
"LUXOR HOTEIS TURISMO S.A","118164,9"
"HOLIDAY INN PARQUE ANHEMBI SÃO PAULO","114629,88"
"SOL INVEST HOTEL JARAGUÁ LTDA","111726,94"
"PESTANA - BAHIAINVEST INVESTIMENTOS TURÍSTICOS LTDA","111093,2"
"BLUE TREE CONVENTION","109251,44"
"GRAND HOTEL CADORO - INDÚSTRIA DE HOTÉIS GUZZONI S/A",101084
"LAHOTELS EMPREENDIMENTOS 2 LTDA","100396,23"
"CENTER NORTE S/A CONSTR. EMPREENDIMENTOS ADMIN. E PARTICIPAÇÃO","96370,5099999999"
"HOTEL BOURBON DE FOZ DO IGUAÇU LTDA","95457,9"
"MAX SAVASSI ADMINISTRAÇÃO HOTELEIRA LTDA","92726,6100000002"
"HILTON DO BRASIL LTDA","91602,35"
"HOTEIS G.P. S/A-FILIAL","88891,77"
"METROPOLITAN HOTEL LTDA",83999
"JANDAIA HOTEL LTDA","82032,6"
"CIA TROPICAL DE HOTEIS","79407,8999999999"
"ROYAL TOWERS S/A","74998,7999999997"
"ATLANTICA HOTELS INTERNACIONAL BRASIL LTDA","74919,6"
"CONSTRUTORA PINHEIRO LTDA-FIESTA HOTEL","73438,5100000001"
"ATLANTICA HOTELS INTERNATIONAL BRASIL LTDA","71345,23"
"HOTEL THERMAS LTDA","71120,06"
"PATEO MOINHOS ADM. E PARTICIPAÇÕES LTDA","69928,9"
"HOTELARIA PRAIA COMPRIDA LTDA","66716,7"
"IBIRAPUERA PARK HOTEL LTDA","61852,25"
"GRAN MARQUISE EMPREENDIMENTOS S.A","58799,9600000001"
"CONVENTO DO CARMO S/A","58492,4300000001"
"MELIA BRASIL ADMINISTRAÇÃO HOTELEIRA E COMERCIAL LTDA","57364,65"
"P. 1. ADMINISTRAÇÃO EM COMPLEXOS IMOBILIARIOS LTDA","55153,8700000001"
"ARATUR - HOTÉIS E TURISMO DE ARACAJU LTDA","53262,25"
"PESTANA NATAL HOTEL","48461,03"
"VALEVERDE TURISMO","48073,84"
"INTERCONTINENTAL HOTELEIRA LTDA","47813,16"
"DEL MAR (COSIL HOTEIS E TURISMO S.A)","47179,35"
"ORIENT-EXPRESS HOTELS BRASIL S.A","46770,24"
"HOTEL RIO DO SONO LTDA","46229,25"
"RV-RIO VERDE HOTELARIA E SERVIÇOS LTDA - PERGAMON LTDA",44980
"LA HOTELS EMPREENDIMENTOS 2 LTDA","44941,05"
"TROPICAL HOTELARIA LTDA","44675,9"
"MELIÁ BRASIL ADM. HOTELEIRA E COMERCIAL LTDA","43895,25"
"IRMÃOS PINHEIRO HOTEIS E TURISMO LTDA.","43788,44"
"HOTÉIS G.P S/A","43225,35"
"ATLANTICA HOTELS INTERN. BRASIL LTDA-BELA CINTRA","42630,7199999999"
"1ª BRIGADA DE ARTILHARIA ANTI-AEREA",42250
"CHALLENGER HOTEIS","40561,8"
"SAN DIEGO SUITES UBERLÂNDIA","40129,8299999999"
"LUSITÂNIA EMPREENDIMENTOS TURÍSTICOS LTDA","39603,2"
"EMPREENDIMENTOS SUL CEARENSE DE HOTEIS E TURISMO S A","39253,99"
"INVESTAR HOTELARIA S/A","39080,5"
"EVEREST RIO HOTEL S/A","38902,5"
"PELOTAS HOTEIS MANTA","36920,46"
"ERCR2007 EMPREENDIMENTOS E PARTICIPAÇÕES S.A","36738,45"
"MERAK EMPREENDIMENTOS E PARTICIPAÇÕES LTDA","36722,5"
"CATUSSABA HOTEL LTDA",36460
"HOTEL PRAIA DO TOMBO LTDA - EPP","36404,28"
"PIRAMIDE PALACE HOTEL LTDA",35886
"RIFÓLIS PRAIA HOTEL LTDA","35823,2"
"RICARDO RUFINO CECILIO - ME",35522
"FIESTA BAHIA HOTEL LTDA",35288
"WEST CORAL HOTEIS E RESORTS LTDA","33963,5"
"ALMEIDA & COSTA LTDA","33914,1"
"K. J. HARJANI & CIA LTDA","32543,5"
"HBS HOTELARIA LTDA","31743,87"
"VICTORY ALUGUEL DE VEÍCULOS E SERVIÇOS LTDA","31231,78"
"BAHIA STELLA HOTEL LTDA",30497
"HOTEL HIMMELBLAU PALACE LTDA","30371,4"
"MACAPA HOTEL","29718,1"
"BOURBON PALACE HOTEL LTDA","29658,2"
"HOTEL PORTOBELLO S.A.",29120
"JATIJUCA ADMINISTRADORA E SERVIÇOS LTDA","29101,19"
"CROWNE PLAZA - CAPITAL CENTER HOTÉIS S.A.","29083,91"
"DIPLOMATA HOTEL",28166
"CENTRO DE ADESTRAMENTO DA MARAMBAIA (CADIM)",27792
"PLAZA COPACABANA HOTEL","27375,81"
"CASTRO HOTÉIS E TURISMO LTDA","27343,45"
"HOT. ACCOR BRASIL S. A.","26971,47"
"CIA TRANSAMÉRICA DE HOTÉIS - SÃO PAULO","26393,66"
"PIRES HOTÉIS E TURISMO LTDA","26367,23"
"KINO EMREENDIMENTO HOTELEIRO LTDA","26183,94"
"CROWNE PLAZA - BELEM","25252,7"
"SALGUEIRO PLAZA HOTEL LTDA - ME",25247
"MACEIO ATLANTIC ADMINISTRADORA HOTELEIRA E COMERCIAL LTDA",25026
"CRER2007- GOLDEN TULIP CONTINENTAL","24727,5"
"RAMOS & SANTOS LTDA - ME",24669
"CTH HOTEIS S/A","24622,45"
"EXCELSIOR COPACABANA HOTEL LTDA","24081,54"
"PARK TOWER HOTEL E CONVEÇÕES LTDA","24046,05"
"GIRO'S TOUR VIAGENS E TURISMO LTDA","23833,84"
"TREVI HOTEL CURITIBA LTDA","23742,4"
"DIPLOMATA CIA DE EMPREENDIMENTOS TURISTICOS","23674,2"
"4M ADM. E PARTICIPAÇÕES LTDA","23163,8"
"HOTEL CHAMONIX RECREIO LTDA - EPP",22778
"HOTELARIA ACCOR BRASIL S.A.","22689,9"
"TAMOYO EMPREENDIMENTOS HOTELEIROS LTDA - SANDRI P.HOTEL",22154
"LUXOR HOTÉIS TURISMO S.A","21745,5"
"HOTEL FEIRA PALACE EVENTOS E TURISMO LTDA",20431
"AMARAL & NICOLAU-HOTELARIA E CONSULTORIA E ADM",20055
"RIVER PARK CONVENÇÕES E HOTELARIA LTDA.",19910
"SERRANO HOTEIS S/A",19690
"LUXOR HOTÉIS TURISMO SA",19614
"RCG -SCP MANHATTAN FLAT SERVICE","19596,5"
"AQUARIUS SERVIÇOS DE HOSPEDAGEM, RESTAURANTE E EVENTOS","19520,1"
"VICTOR BUSINESS HOTEL LTDA","19434,25"
"HOTEL CEL. BERTASO S.A",19280
"LOCALIZA RENT A CAR S/A","19090,45"
"J.H.H. HOTEIS LTDA",19075
"NOBRE PALACE HOTEL LTDA","18399,25"
"HOTEL DE TRANSITO DA MARINHA EM INEMA",18388
"IHC SÃO PAULO HOTELARIA LTDA","18285,64"
"PSEG-PNX ADMINISTRAÇÃO DE HOTEIS E RESTAURANTES LTDA","18099,1"
"HAVANA PALACE HOTEL LTDA",18058
"MENDES HOTEIS TURISMO E ADMINISTRADORA LTDA",17865
"ROWE LTDA","17769,21"
"HOTELARIA ACCOR BRASIL S/A - HOTEL IBIS","17740,77"
"ANGRA INN HOTEL","17597,77"
"PESTANA RIO ALANTICA HOTEL",17430
"ERCR 2007 EMPREENDIMENTOS E PARTICIPAÇÕES S.A","17396,4"
"WTCD ADMINISTRAÇÃO E HOTELARIA LTDA","17197,3"
"EVEREST HOTEIS S.A","17121,55"
"VERDES VALES LAZER HOTEL",17108
"BRISTOL HOTELS","17046,55"
"ORGBRISTOL - ORGANIZAÇÕES BRISTOL LTDA","17006,85"
"CANTO DO SOL HOTÉIS E TURISMO LTDA","16784,25"
"CBB SÃO JOSÉ DOS CAMPOS ADMINISTRAÇÃO HOTELEIRA E COMERCIAL LTDA","16780,05"
"CBB FARIA LIMA ADMINISTRAÇÃO HOTELARIA E COMERCIAL LTDA",16632
"MERCURE NORTEL","16373,1"
"POUSADA DO MONDEGO LTDA","16358,1"
"JOINVILLE EXPRESS EMPREENDIMENTOS LTDA","16123,62"
"HOTEL LUZEIROS","15787,2"
"HOTEL IMPERADOR GALVEZ","15694,31"
"HOTEL MAR ABERTO LTDA",15670
"VISUAL PRAIA HOTEL LTDA.",15600
"MORUBI HOTEIS",15435
"MELIÁ BRASIL ADM HOTELEIRA E COMERCIAL LTDA","15359,16"
"SOLARUIM SÃO PAULO S.A.",15270
"HOTEIS VILLA MOURA LTDA",15100
"HOTELARIA ACCOR BRASIL LTDA","14963,4"
"CLUBE RECREATIVO TUCURUÍ",14889
"HOTEL BELLA ITÁLIA LTDA",14885
"SÃO LUIS INVEST HOTELARIA E TURISMO LTDA","14873,99"
"SOCIEDADE HOTEL DE GOV. VALADARES - REALMINAS",14829
"INTERCONTINENTAL HOTELARIA LTDA","14722,6"
"RESSE TURISMO HOTEIS LTDA","14588,2"
"PESTANA CURITIBA","14558,02"
"CPV-BPF ADMINISTRAÇÃO DE HOTEIS E RESTAURANTES LTDA","14556,15"
"TRANSCONTINENTAL HOTÉIS E TURISMO LTDA","14327,2"
"ATRIO HOTÉIS S/A - SCP PRINZ","13810,06"
"FLORESTA AMAZÔNICA HOTEL E TURISMO LTDA",13790
"QUINTELA TORRES CONSTRUTORA E INCOPORADORA LTDA","13788,6"
"BASTOS HOTÉIS E TURISMO LTDA",13723
"ITUPEVA HOTEIS CONVENÇOES E EVENTOS LTDA","13643,46"
"TOWER FRANCA HOTEL",13629
"RIVERSIDE PARK HOTEL LTDA","13585,2"
"CATUSSABA RESORT HOTEL LTDA",13500
"PLANTRAVEL PLANEJAMENTO VIAGENS E TURISMO LTDA","13494,6"
"HOTELARIA ACCOR BRASIL S.A - PARTHENON LINDACAP","13458,74"
"HOTEL ACALANTO LTDA",13325
"J.B. PALACE HOTEL LTDA",13244
"ALPHALINS TURISMO LTDA - BLUE TREE PARK LINS",13200
"DEVILLE HOTEIS E TURISMO LTDA","13051,35"
"MELONGENA PARTICIPAÇÕES LTDA",13020
"HOTEL BEIRA RIO DE ITUMBIARA LTDA",13016
"ATLANTICA HOTELS INTENATIONAL BRASIL LTDA","12931,13"
"HOTEIS CONTUR LTDA","12648,8"
"POSSEIDON HOTEL LTDA","12647,5"
"CUTRALE EMPREENDIMENTOS LTDA","12641,2"
"CREACTEVE EVENTOS E TURISMO LTDA",12600
"OUROTUR ORGANIZAÇÃO LTDA","12566,4"
"HOTELARIA ACCOR BRASIL","12533,15"
"PORTAL HOTÉIS LTDA",12460
"EUZEBIO MAIA - EPP",12340
"JOAO PAULO HOTEL","12319,65"
"ATHANASE SARANTOPOULOS HOTEIS E TURISMO","12269,92"
"IBIRAPUERA PARK HOTEL",12176
"ROYAL SAVASSI HOTEL","12154,8"
"TRANSAMERIA FLATS S/C LTDA","12130,65"
"CASTOR & LEÃO ADMINISTRAÇÃO HOTELEIRA S/A","12065,55"
"ATLANTICO PRAIA HOTEL LTDA","12053,34"
"BPS TURISMO LTDA - HOTEL COROADOS","11984,5"
"ATLANTICA HOTELS INTRNACIONAL LTDA","11981,4"
"CESAR - POSADAS DO BRASIL EMPREENDIMENTOS HOTELEIROS LTDA","11813,34"
"ORGBRISTOL ORGANIZAÇÕES BRISTOL","11725,9"
"BAOBA PARTICIPAÇÕES E ADMINISTRAÇÃO LTDA","11713,68"
"MELO HOTEIS LTDA",11625
"M.N. PORTO HOTÉIS LTDA","11567,8"
"BOURBON ADM. DE BENS LTDA","11547,9"
"EMPRESA HOTELEIRA NICOR LTDA","11415,53"
"CELI EMPREENDIMENTOS HOTELEIROS LTDA","11356,25"
"M ANDRADE ADMINISTRAÇÃO DE BENS LTDA",11355
"COSTA NORTE HOTELARIA LTDA. - INGLESES",11340
"ATLANTICA HOTELS INTERNATIONAL (BRASIL) LTDA","11253,9"
"MELIA BRASIL ADM.HOTELARIA E COMERCIAL LTDA","11226,6"
"IC SOLUÇÃO EM HOTELÁRIA LTDA",11223
"MATIAS E MONTEIRO LTDA",11150
"LAZAR COMÉRCIO DE ALIMENTOS E SERVIÇOS HOTELEIROS LTDA",11080
"HOTEIS DA FONTE SA","10799,25"
"P.1 ADMINISTRAÇÃO EM COMPLEXOS IMOBILIÁRIOS LTDA.","10629,06"
"HOTEL TURISMO LE MAZOT SURMER LTDA","10611,84"
"PAULISTA PRAIA HOTEL SA","10606,25"
"ALEXANDRE MATTAR IND. HOT. LTDA - HOTEL DAS PALMEIRA",10545
"CONSTRUTORA KNOW HOW LTDA",10256
"TUPAN HOTEIS LTDA",10180
"HOTUCAFRE-HOTEIS E TURISMO CALADO DE FREITAS LTDA",10152
"HOTÉIS DELPHIN LTDA",10150
"M.P.A. PARTICIPAÇÃO E ADMINISTRAÇÃO DE BENS E NEGÓCIOS LTDA","10116,7"
"HOTEL JACQUES GEORGES LTDA",10101
"OTHON PALACE BELO HORIZONTE",10101
"SAMIA QUIMSIEH BADRA",10080
"HOTEIS ELDORADO CUIABA S/A","10039,5"
"POUSADA DAS ARARAS LTDA",10017
"BLUE TREE HOTELS & RESORTS DO BRASIL S/A","9958,57"
"MELIÁ CONFORT- JESUINO ARRUDA","9882,08"
"CONTINENTAL INN HOTEL LTDA",9800
"MONUMENTAL HOT. ACCOR BRASIL S.A - MERCURE",9785
"LAGUNA TOURIST HOTEL LTDA",9750
"Z.T. EMPREENDIMENTOS TURÍSTICOS LTDA",9712
"HOTEL DE TURISMO PARQUE BALNEARIO LTDA","9645,12"
"J COUTO OLIVEIRA LTDA HOTEL VILLAGE","9582,14"
"AGOSTINI & LUNARDELLI LTDA",9448
"RANCHO DOS CARVALHOS LTDA",9320
"HOTEL FAZENDA SÃO FRANCISCO",9270
"HOTEL VALE REAL",9220
"MERCO PLAZA HOTEL - HZ HOTELARIA E ADM. IMÓVEIS LTDA",9192
"CURUMIM TRANSPORTES DE LOCAÇÃO LTDA","9190,06"
"ÁBACO HOTELARIA E SERVIÇOS S/A",9179
"M.P.S. SERVIÇOS LTDA - ME",9159
"BLUE TREE TOWERS - HOTELS & RESORTS DO BRASIL S/A","9144,48"
"INTERCITY HOTÉIS LTDA",9096
"J. LEONE EMPREENDIMENTOS HOTELEIROS E TURISMO LTDA",9060
"GUANABARA PALACE HOTEL LTDA","9040,5"
"POUSADA ZÉ MARIA LTDA",9000
"HOTEIS MARTINS LTDA","8997,75"
"POSADAS SUDAMERICA LTDA- CESAR BUSINESS","8857,8"
"W-TUR HOTEIS E SIMILARES LTDA",8770
"HOTEL OT LTDA","8747,15"
"B F BIANCINI HOTEL LTDA",8536
"MITSUKO MAYEJI - ME - REGIS HOTEL",8535
"PARNATUR TURISMO LTDA",8508
"ARMANI HOTEL LTDA",8490
"VALETUR VALE DO SÃO FRANCISCO TURISMO LTDA.",8400
"FEIRA PALACE HOTEL",8330
"RCD EMPREENDIMENTOS LTDA",8323
"BLUE TREE HOTELS & RESORT DO BRASIL S/A",8316
"VIEIRALVES EMPREEND.HOTELEIROS LTDA- CENTER PARK HOTEL",8175
"SOL BARRA HOTEL LTDA",8165
"SOTEL HOTELARIA LTDA","8089,76"
"F. ANTÔNIO DA SILVA HOTEL","8048,25"
"PETROLINA PALACE HOTEL LTDA","7996,56"
"HOTEL RIO PARNAÍBA LTDA",7991
"REDE POUSADA LTDA","7919,75"
"HOTEL PRAIA DE ITAPOÃ S/A","7886,71"
"WOLFF COMERCIAL INCORP E ADMINISTRADORA LTDA",7850
"SPYDER GESTÃO EMPRESARIAL LTDA",7825
"SHELTON INN HOTEL ARARAQUARA LTDA","7814,24"
"LIBERTY PALACE",7769
"SENAC -SERVIÇO NACIONAL DE APRENDIZAGEM COMERCIAL",7733
"ESTANPLAZA ADMINISTRADORA HOTELEIRA E COMERCIAL LTDA","7719,6"
"AMAZON AMBASSADOR PESCA E TURISMO LTDA",7580
"V.L. CORREA & CIA LTDA-ME",7550
"HOTEL VILLAGE CAMPINA GRANDE","7484,4"
"M. AUGUSTO G. COELHO - RITZ LAGOA DAS ANTAS","7432,45"
"LETUR EMPREENDIMENTOS TURÍSTICOS LTDA",7420
"AQUARIOS PRAIA HOTEL",7305
"ORGBRISTOL ORGANIZAÇÕES BRISTOL LTDA","7260,75"
"HOTEL FAZENDA DOS OLIVEIRAS",7245
"LUIZ EVANILDO DE FRANÇA - HOTEL BELAS ARTES",7202
"NOBRE PÁLACE HOTEL LTDA","7175,3"
"FONTES SERVIÇOS GERAIS LTDA-HOTEL DEL PRINCIPE",7150
"ALLINE A. MEREIRA MEDIO NORTE HOTEL",7110
"MBM ADMINISTRAÇÃO E SERVIÇOS HOTELEIROS LTDA ME",7110
"ALPHONSUS HOTEL C.R.HOTÉIS LTDA - ME",7092
"QUALITY SUITES VILA VELHA","7063,85"
"CRISUL HOTÉIS E TURISMO S/A",7020
"HOTEL AVENIDA PALAX LTDA",6972
"ANTONIO'S PALACE HOTEL LTDA",6948
"DACOPAR DA COSTA PARTICIPAÇÕES LTDA","6935,25"
"ARPOADOR DE HOTÉIS E TURISMO LTDA","6934,2"
"RIEMA EMPREENDIMENTOS IMOBILIÁRIOS LTDA","6926,5"
"GOLDEN INGÁ APART HOTEL LTDA",6870
"ATLANTICA HOTELS INTERNATIONAL QUALITA (CCO) S/A","6844,85"
"BRISTOL ADMIN DE HOTEIS E CONDOM S/S LTDA",6840
"MALIBU PALACE HOTEL S/A","6825,2"
"ERMITAGE HOTEIS E TURISMO LTDA",6804
"CASTRO MARQUES ANFARMA LTDA",6780
"TS HOTELARIA E TURISMO LTDA.",6707
"CACHOEIRO PLAZA HOTEL","6655,95"
"CHUVA DE PRATA HOTEL LTDA",6615
"D.M. SIMEIRO - HOTEL - ME",6600
"HOTELÉO - HOTÉIS E TURISMO LTDA-LEON PARK",6570
"HOTEL SAMAÚMA LTDA",6510
"PLENA HOTÉIS LTDA","6498,27"
"MENDES PLAZA HOTEL",6490
"VILLE ATLÂNTICO HOTÉIS E TURISMO LTDA",6412
"ITAMARATY HOTÉIS LTDA",6410
"MERIT PLAZA HOTEL LTDA","6376,12"
"RESULTS ASSESSORIA E ADMINISTRAÇÃO LTDA.","6310,5"
"HOTEL DEVILLE CUIABA","6260,2"
"EJS HOTEIS E TURISMO S/A",6248
"HOTEL ANACÃ SÃO CARLOS LTDA",6210
"ISLAMAR HOTEIS LTDA","6197,5"
"CARUARU PARK HOTEL LTDA",6196
"MESQUITA ADM. DE HOTEIS LTDA (HOTEL CANTO DA FLORESTA)","6177,6"
"PLENA HÓTEIS LTDA","6152,19"
"M.P.A. HOTELARIA E TURISMO LTDA",6150
"SODER HOTEL LTDA",6150
"LE PREVILEGE ADMINISTRADORA DE HOTÉIS E CONDOMÍNIOS LTDA",6105
"HOTEL IMPERATRIZ",6060
"JR HOTEL LTDA",6030
"M.N. VASCONCELOS LIMA",6020
"POUSADA LAS PALMEIRAS",5925
"DEL REY HOTEL LTDA",5880
"HOTEL CONSULTING ADMINISTRAÇÃO E SERVIÇOS S/C LTDA","5845,45"
"F. DOS SANTOS BARBOSA HOTEL",5790
"CARLOS ALBERTO ZEVARX - ME",5740
"PRATAS PARK HOTEL LTDA.",5710
"MARROQUIM HOTEIS E TURISMO LTDA","5707,9"
"DE ROSE HOTÉIS E TURISMO LTDA",5665
"NEW LIFE PIRACICABA",5642
"HOTEL PAMPIANO LTDA",5640
"HOTEL PARQUE DOS COQUEIROS","5632,9"
"PERICLES AMARAL BRANDÃO E FILHOS LTDA","5625,9"
"ITAGY HOTEL","5546,38"
"HOTEL POUSADA SOLAR DA ÓPERA LTDA",5539
"COMERCIAL LUPO S/A",5490
"VERDE HOTEIS LTDA - ME","5429,45"
"HOTEL CURITIBA CAPITAL S/A",5428
"HOTEL TURISMAR","5262,5"
"SANDRA TURISMO HOTEIS S/A",5240
"ATLÂNTICA HOTELS INTERNACIONAL BRASIL LTDA","5226,25"
"HOTEIS DEVILLE LTDA","5212,9"
"PLAZZA HOTEL",5160
"GOLDEN EXECUTIVE HOTEL LTDA","5139,26"
"ESTANCIA PARK HOTEL",5129
"HOTEL PIRA",5117
"TAJ HOTEL LTDA","5112,8"
"SAN MARINO HOTEL - ORGANIZAÇÃO HOTELEIRA JOMATEL LTDA",5080
"HOTEL AEROPORTO LTDA","5035,8"
"NOUMI EMPREENDIMENTOS HOTELEIROS LTDA","5025,58"
"CHURRASCARIA PANTANAL","5001,5"
"REGENTE FLAT SERVICE LTDA",4944
"JOSÉ VIEIRA FONTES FILHO",4900
"MARA PALACE HOTEL LTDA",4900
"G. HENRIQUE ARAÚJO - ME",4860
"R. C. MORAES",4830
"LOURIVAL PESSOA MARQUES FILHO-ME-SPAZIO HOTEL",4826
"COMERCIAL MUNIQUE DE ALIMENTOS LTDA",4800
"SAN CONRADO PLAZA HOTEIS E TURISMO LTDA - EPP",4795
"MARINA'S BAR RESTAURANTE LTDA",4790
"TRANSBRASILIANA HOTEIS LTDA",4777
"CRUZ DE MALTA EMPREENDIMENTO TURÍSTICO LTDA",4725
"SLEEP INN",4725
"P.K. HOTELARIA E ADM. DE BENS LTDA",4710
"HOTEIS ROYAL PALM PLAZA LTDA","4672,5"
"POUSADA PONTAL DOS ANJOS - JOÃO GERVÁSIO PAIXÃO -ME",4670
"MELIÁ BRASIL ADMINISTRAÇÃO HOTELEIRA E COMERCIAL",4665
"IRMANDADE SANTA CASA DE MISECORDIA DE SOBRAL",4629
"JOÃO RODRIGUES MANTA HOTÉIS DE TURISMO LTDA","4628,82"
"ITATIAIA PALACE HOTEL CHAPECÓ LTDA","4628,3"
"C.G EMPREENDIMENTOS TURISTICOS LTDA",4610
"CASIMAR EMPREENDIMENTOS E TURISMO LTDA",4590
"DN HOTEL LTDA - ME",4580
"MARISE PRACO GAIOTTO FERREIRA ME",4528
"FLORIANO ALVES BANDEIRA","4525,4"
"ALMIR DA FONSECA POUSADA ME",4485
"VILLAGE RESORT DO BRASIL LTDA","4470,15"
"PODIUM APART/HOTEL LTDA","4457,3"
"MARIA DE MELO ÁVILA",4335
"SOLUTION ADMINISTRAÇÃO DE HOTÉIS & RESORTS LTDA","4331,94"
"HOTEL SAN JUAN LTDA",4315
"HOTEL DE TRANSITO DE OFICIAIS DE SÃO GABRIEL DA CACHOEIRA-AM",4305
"IPORA HOTEIS E TURISMO LTDA",4301
"JPA EMPREENDIMENTOS HOTELEIROS E TURÍSTICOS LTDA - MRE",4299
"HOTEL PEDRA NEGRA LTDA",4297
"TRADE GARDEN HOTEL LTDA","4288,25"
"MGM HOTEIS LTDA",4270
"DM HOTEIS E PROMOÇÕES DE EVENTOS LTDA - EPP",4250
"POUSADA CLÁSSICA DE OURO PRETO LTDA",4246
"HOTEL EXECUTIVE LTDA",4242
"KINO EMPREENDIMENTO HOTELEIRO LTDA","4236,75"
"KINO EMPEENDIMENTO HOTELEIRO LTDA","4168,5"
"LIVRAMENTO PALACE HOTEL LTDA",4124
"LAHOTELS EMPREENDIMENTOS 1 LTDA",4116
"LIGATUR HOTELARIA E TURISMO LTDA",4115
"HOTEL BONS TEMPOS LTDA",4075
"STAFF ADMIN LTDA - UBERABA APART HOTEL",4037
"OCTAVIANO ZANDONAI E FILHOS LTDA",3993
"NARA LAISE FREIRE SILVA",3978
"SANTOS DUMONT INVEST. IMOBILIARIO S/A - NOVOTEL RJ SANTOS DUMONT","3977,4"
"PLINIO VARNIER",3970
"ABOUL & HOSN LTDA - ME",3960
"CUNHAS HOTEL E TURISMO LTDA",3960
"HOTEIS SLAVIERO DO BRASIL LTDA",3948
"SALTO GRANDE TURIS HOTEL LTDA",3880
"TARUMÃ EMPREENDIMENTOS TURÍSTICOS LTDA",3880
"POUSADA MIRANTE DO CAFÉ LTDA",3860
"HOTEL IMBAÚ PALACE LTDA",3840
"HOTEIS E TURISMO FLORESTA S/A",3834
"PORTOBELLO SALVADOR HOTÉIS E TURISMO LTDA","3806,25"
"LANCHONETE IRAES LTDA- LANCH TONY E THAIS",3771
"DE GUERINO RIGO & CIA. LTDA. RIGO HOTEL",3722
"DAN INN HOTEL RIBEIRÃO PRETO LTDA",3700
"MARIA ANGELA MAGALHÃES ELIAS - ME",3650
"INSPEDTORIA SAO JOAO BOSCO CENTRO DOM BOSCO","3647,88"
"GARDEN TERRACE HOTEL",3600
"COSTA NORTE TURISMO LTDA -EPP",3589
"R.C.R. HOTEL LTDA-ME",3588
"HOTEL E RESTAURANTE RULIZ LTDA",3586
"NORTE PALACE HOTEL",3552
"VALMA DOS SANTOS RODRIGUES",3540
"ORGANIZAÇÃO HOTELEIRA ITAPETININGA LTDA",3535
"HOTEL PARAUHAU LTDA","3512,25"
"COMPANHIA NORTE MINEIRA DE HOTEIS E TURISMO","3509,07"
"A. U. DA COSTA SOUZA - ME",3500
"FENIX HOTEL",3478
"BONANÇA - HOTÉIS E TURISMO LTDA.",3435
"HOTEL DON ANTONIO",3420
"LORENÇONI E CIDALLO LTDA - ME",3420
"HOTEL VALE DO TOCANTINS",3400
"ESTANPLAZA IBIRAPUERA ADMINISSTRADORA HOTELEIRA E COMERCIAL LTDA.","3391,5"
"UMUARAMA PLAZA",3380
"P E W EMPREENDIMENTOS COMERCIAIS LTDA",3375
"OCEANO PRAIA HOTEL LTDA",3365
"COMPANHIA HOTÉIS DO LEME",3360
"LUXOR HOTEIS TURISMO SA","3324,3"
"HOTEL DELLA VOLPE LTDA","3286,5"
"SERVIÇO SOCIAL DO COMERCIO - SESC",3279
"PORTO SEGURO HOTEL SALTO LTDA",3259
"PILÕES PALACE HOTEL LTDA",3177
"M. C. G. MONTEIRO",3150
"GB DA SILVA HOTEL E CHURRASCARIA  - ME","3145,44"
"HOTEL EXPRESS LTDA",3120
"J.A.D ARAÚJO & CIA",3090
"M C C SAMPAIO - ME",3090
"WINDSOR BARRA HOTEL LTDA","3071,38"
"CRYSTAL PALACE HOTEL","3064,9"
"IRMÃOS ALVES EMPREENDIMENTOS TURÍSTICOS LTDA",3060
"J. MALUCELLI HOTÉIS E TURISMO LTDA",3045
"TERMINAL CENTER HOTEL LTDA","3040,6"
"BLUE TREE HOTEL","3029,25"
"CERQUEIRA & SILVA LTDA",3000
"HOTEL TAKANA",3000
"SARAIVA ADMINISTRAÇÃO HOTELEIRA LTDA",3000
"HOTEL VARANDAS ARARAQUARA LTDA - ME",2976
"P.J.P. LOCAÇÕES E SERVIÇOS LTDA - BRASÍLIA RENT A","2967,25"
"SOPAL HOTEIS CARIRIS LTDA",2934
"EXECUTIVE HOTEIS E TURISMO LTDA - EPP",2928
"HOTEL DALL'ONDER LTDA","2894,3"
"REDE NOBRE DE HOTELARIA LTDA",2838
"PONTA VERDE LTDA",2809
"BARRAVENTO HOTEL LTDA",2800
"WEMBLEY EMPREENDIMENTOS TURÍSTICOS LTDA",2780
"LESSA HOTEL LTDA",2750
"LANG PALACE HOTEL","2739,84"
"EMPREENDIMENTO HOTELEIRO CLIMAX LTDA",2704
"S. M. DA  S. MENDONÇA",2660
"SOCIEDADE DE HOTÉIS E TURISMO LTDA",2650
"PRINCIPE HOTEL LTDA","2632,5"
"GOLDEN TOWER HOTEIS E TURISMO LTDA","2622,38"
"OLIVVER INN THE PREMIUM APART HOTEL","2620,8"
"NOVO HOTEL MUNICIPAL","2597,94"
"LAZAR EMPREENDIMENTOS TURÍSTICOS S/A",2580
"AMARRAÇÃO EMPREENDIMENTOS TURISTICOS LTDA",2540
"ANASTACIO ALBERTO TEIXEIRA & CIA LTDA",2540
"ELIANE DE SOUZA LOPES PAIXAO - ME",2520
"HOTEL GUIMARÃES LTDA",2520
"HOTEL CANAA",2485
"HOTELARIA ACCOR BRASIL S/A - SCP SAINT LAWRENCE FLAT SERVICE","2482,2"
"HOTEL CENTER PALACE",2450
"CLARICE PRETTO COLAGIOVANI - ME",2395
"HOTEL ATLANTIS BOULEVARD",2380
"NOGUEIRA DE LIMA E FILHOS LTDA",2358
"ONIGRAT HOTEL LTDA","2297,4"
"HOTEL E POUSADA DAS ACÁCIAS LTDA",2270
"SILVIO GABRIEL FREITAS - ME",2254
"CONGREGAÇÃO REDENTORISTA NORDESTINA",2250
"FINOS SABORES RESTAURANTE LTDA ME MEE",2217
"ASPPEN HOTEL LTDA","2212,4"
"PIZZATO PRAIA HOTEL LTDA",2200
"INGRA HOTEL LTDA","2171,4"
"HOTEL FÊNIX LTDA",2150
"EMPRESA COLONIAL DE HOTEIS LTDA","2142,4"
"TOURIST PARQUE HOTEL - REDE MANTA DE LAZER E TURISMO","2141,37"
"HOTEL NACIONAL INN CAMPINAS LTDA",2110
"UNIQUE SERVIÇOS DE HOTELARIA E ALIMENTAÇÃO","2053,41"
"BOA VIAGEM PRAIA",2040
"HOTEL JATIUCA S/A",2032
"ESTON HOTEL LTDA",2015
"GETULIO VARGAS FALCO - EPP",1980
"LMS HOTEIS E TURISMO LTDA - TRIANON","1966,5"
"HOTEL ENCOSTA DA SERRA LTDA",1950
"MELIÁ BRASIL ADM. HOTELEIRA COMERCIAL LTDA",1917
"BAY PARK",1914
"AUGUSTO CESAR FARIAS DE OLIVEIRA","1912,5"
"LEITERIA SÃO LUIZ COMÉRCIO E INDÚSTRIA LTDA",1890
"HOTEL TREVÃO LTDA",1880
"LUERLU VOLUPIA RODOTEL LTDA ME",1880
"M & T. ALOJAMENTOS LTDA-ME",1830
"P.H.HOTEL LTDA.",1815
"JOAQUIM TAVARES DE SÁ NETO",1814
"HOTEL PORTOBELLO",1784
"A. TEIXEIRA DE RESENDE",1780
"CONDOMÍNIO DO EDF. CORAL INN APART HOTEL","1776,5"
"CIBELY SOARES BARRA",1755
"GRAN ROYALLE CASA DE PÃES LTDA","1749,3"
"POUSADA DOS CHAPURYS",1740
"HOTEL DA COSTA LTDA","1720,95"
"F. ELIAS DE MENDONÇA - ME",1680
"HOTEL PETROPOLIS LTDA",1620
"CASABLANCA CENTE HOTEL LTDA","1614,6"
"MANOEL ARAÚJO DOS SANTOS",1600
"BRISA MAR HOTEL S/A",1582
"HOTEL E TURISMO CARLTON PLAZA LTDA","1562,4"
"POUSADA E RESTAURANTE ENERGIA",1560
"CSVS COMERCIO SERVIÇOS VASCONCELOS SANTOS LTDA",1550
"SASSOURAT ADM HOTEL MONTESE",1542
"IVANDY RAMALHO DE ANDRADE FILHO - ME",1530
"FARIA E SIMONELLI LTDA",1520
"F F A NOLETO & CIA LTDA",1500
"HOTEL DE TRÂNSITO DA BASE AEREA DE SALVADOR",1500
"HOTEL UNIÃO",1500
"RESTAURANTE D´ITÁLIA",1500
"SERVIÇO SOCIAL DO COMÉRCIO - SESC",1495
"CAFE E RESTAURANTE DEGUSTE LTDA",1482
"LE CANARD SERVIÇOS DE HOTELARIA LTDA",1482
"M. H. G. AVELAR - ME",1465
"HOTEL DAS AMÉRICAS LTDA (BURITIS)",1440
"LEDU EMPREENDIMENTOS HOTELEIRO LTDA",1440
"ATNAS HOTEL E TURISMO LTDA",1439
"CHAVES PALACE HOTEL",1400
"CHARQUEADA SANTA RITA LTDA","1364,6"
"IMPERIAL SUZANO APART HOTEL LTDA - ME",1361
"ELENAURA SUYLA ALVES RIBEIRO ME",1350
"FAZENDA SANTA CLARA",1350
"TREV¹US HOTEL LTDA ME",1350
"A. S. VILHENA - ME",1340
"HOTEIS CJ EXPRESS INN LTDA",1330
"AMERICAN PALACE HOTEL LTDA",1325
"MATHEUS DE ANDRADE MENDES SCAVACINI ME",1320
"RITZ PLAZA HOTEL LTDA",1320
"LIAU GROUP HOTELARIA E ADMINISTRAÇÃO DE BENS LTDA","1305,01"
"GRAN MELIÁ MOFARREJ","1301,08"
"BOCA DO MONTE HOTEIS E TURISMO LTDA",1300
"J. S. DUARTE - ME",1290
"CLASSE APART ACALANTO",1280
"HOTEL PAUSADA DAS ARARAS","1271,2"
"BARBOSA COMERCIAL","1256,76"
"LAGO HOTEL LTDA",1240
"IRMA HACK",1230
"GRANDE HOTEL DE OURO PRETO LTDA","1215,8"
"ASSIS BRASIL HOTEL",1200
"FERNANDA RAULINO DE SOUZA CAETANO",1190
"HOTEL COLONIAL LTDA",1170
"HOTEL TURISMO LTDA.",1170
"SUAVE SABOR RESTAURANTE E LANCHONETE LTDA - EPP",1168
"BERNARDUS RESTAURANTE LTDA-ME",1156
"POUSADA VILLA DUMONT LTDA",1130
"CHURRASCARIA BOI NA BRASA LTDA-ME",1125
"DOTEL OPERADORA DE SERVIÇOS HOTELEIROS LTDA","1123,2"
"HOTEL MARQUES LTDA",1120
"NATUREZA EMPREENDIMENTOS HOTELEIROS LTDA ME",1116
"SAMPAIO E FELIPE LTDA",1095
"NEW ANAPOLIS HOTEL",1088
"HOTEL REFUGIO",1080
"POUSADA MONTE IMPERIAL KOELLER LTDA ME",1078
"HOTEL HELOISA E FILHO LTDA",1071
"HOTEL DE TRÂNSITO DA BASE DO GALEÃO",1038
"PREZUNIC COMERCIAL LTDA","1036,76"
"VICENTE E BENTO MICHETTI LTDA",1023
"LUXOR HOTEIS","1010,5"
"PREDIAL E ADMINISTRADORA HOTEIS PLAZA S.A.","1002,39"
"HOTEL FLAMBOYANT INN LTDA",1000
"MARIA EDILANDA SILVEIRA - ME",988
"J. M. DE ARAÚJO",980
"APARECIDA FATIMA VILALBA FALCO - ME","955,5"
"HTC HOTELARIA LTDA - CASA DO MANEQUINHO",946
"HOTEL FERNANDES",945
"OESTE PLAZA HOTEL LTDA",930
"TRINDADE & PASCHOALETO LTDA",925
"ARSOL RESTAURANTE LTDA","921,6"
"A.D.T. DEL AGUILA",900
"COMÉRCIO E INDÚSTRIA AZIS ABRAS LTDA",900
"MARIA ZENILDA FEITOSA",900
"RICARDO NAKAIE - ME",900
"ORION COPACABANA HOTEL LTDA - ORLA","893,55"
"M. ELVIA P. G. SAAVEDRA",875
"ANDRELINA RODRIGUES MARTINS ME",860
"FLÁVIO TAUIL CAETANO - ME",860
"MASTER PLAZA EMPREENDIMENTOS LTDA",855
"ATLANTA HOTEL LTDA.",852
"L. AURELIANO CAVALCANTE MOTA - ME",850
"GELPS HOTEIS E PARTICIPAÇÕES LTDA - ME",847
"HOTEL FLORENÇA IGUAÇU LTDA",840
"MACEDO & MOURA LTDA - ME",840
"NINA COMERCIO DE ALIMENTOS LTDA","814,45"
"RESTAURANTE E BAR AMARELINHO DA GLÓRIA LTDA",810
"HOTEL DEL REY LTDA","808,5"
"GRNADE HOTEL BLUMENAU",808
"SLAVIERO HOTELS E TURISMO LTDA","803,25"
"ÁLVARO SANTANA & CIA LTDA",800
"HOTEL E RESTAURANTE MAICHEL LTDA",800
"WESTERN HOUSE - RESTAURANTE FINO SABOR","790,5"
"HUELLMAN GOBBI CARVALHO - ME",790
"MARIA ELISABETE LOMBELLO TEDESCHI",780
"ROSA MARIA CARDUM",780
"CARREFOUR COMÉRCIO E INDÚSTRIA LTDA","768,63"
"POUSADA LIMARQUES",768
"COHOVALE-CIA DE HOTEIS VALE DO TOCANTINS LTDA",760
"HOTELARIA RODRIGUES DA CUNHA LTDA","757,05"
"HOTELAR HOTELARIA E ADMINISTRAÇÃO LTDA",750
"GARBOS TRADE HOTEL LTDA","733,04"
"DALLAS HOTEL LTDA",725
"HOTÉIS CARIRI LTDA",720
"MUCIO CARNEIRO DOS SANTOS",720
"SOL VICTORIA MARINA","718,2"
"LUIZ DE BORBA SOBRINHO",690
"LINDOYA HOTEL",680
"TELEMAR NORTE LESTE S/A","674,25"
"RIVER PALACE HOTEL LTDA","664,17"
"GURUPI PALACE HOTEL",664
"CENTRO INTEGRADO DE DEFESA AÉREA E CONTROLE DO TRÉFEGO AÉREO",660
